[
  {
    "material_folder": "Ag(AuF4)2-mp-18125",
    "POSCAR": "Ag2 Au4 F16\n1.0\n  10.9756379699999993    0.0000000000000000    0.0000000000000007\n  -0.0000000000000002    3.9543407604419123    3.3389055229688709\n   0.0000000000000000    0.0000000000000000    7.2070078999999998\nAg Au F\n2 4 16\ndirect\n   0.5000000000000000    0.5000000000000000    0.5000000000000000 Ag\n   0.0000000000000000    0.5000000000000000    0.0000000000000000 Ag\n   0.6801621300000000    0.2511594300000000    0.0283424100000000 Au\n   0.1801621300000000    0.7488405700000000    0.4716575900000000 Au\n   0.8198378700000000    0.2511594300000000    0.5283424100000000 Au\n   0.3198378700000000    0.7488405700000000    0.9716575900000000 Au\n   0.2226471500000000    0.4469760300000000    0.2593979200000000 F\n   0.7226471500000000    0.5530239700000000    0.2406020800000000 F\n   0.7773528500000000    0.5530239700000000    0.7406020800000001 F\n   0.2773528500000000    0.4469760300000000    0.7593979199999999 F\n   0.1693479300000000    0.9061684600000000    0.7895755900000000 F\n   0.6693479300000000    0.0938315400000000    0.7104244100000000 F\n   0.0875499600000000    0.0380715700000000    0.1663410000000000 F\n   0.5875499600000000    0.9619284299999999    0.3336590000000000 F\n   0.9124500400000000    0.9619284299999999    0.8336590000000000 F\n   0.4124500400000000    0.0380715700000000    0.6663410000000000 F\n   0.0275463600000000    0.5980012000000000    0.6556904000000000 F\n   0.5275463600000000    0.4019988000000000    0.8443096000000000 F\n   0.9724536400000000    0.4019988000000000    0.3443096000000000 F\n   0.4724536400000000    0.5980012000000000    0.1556904000000000 F\n   0.3306520700000000    0.9061684600000000    0.2895755900000000 F\n   0.8306520700000000    0.0938315400000000    0.2104244100000000 F\n",
    "Material_Cost_USD_per_kg": 46544.89,
    "Band_Gap_eV": 0.258499999999999,
    "Pearson_Electronegativity_eV": 8.654396607591972,
    "CBM_eV": -8.525146607591973,
    "VBM_eV": -8.78364660759197,
    "K_GPa": 32.24798583984375,
    "G_GPa": 13.974284172058105,
    "E_GPa": 36.63156676765069,
    "E_tilde_GPa": 162.7598900568618,
    "E_coh_eV_per_atom": -2.585854821666371,
    "avg_cn": 2.5454545454545454,
    "porosity": 0.7317210630913151,
    "AAV": 14.217923793410698,
    "TE_300K": -16.243894399,
    "T2": 670.3236106604302,
    "CTE_ppm": -17.518384406492537,
    "volume_shrinkage": -0.01167648301516,
    "volume_shrinkage_percent": -1.167648301516,
    "NTE_temp_range": [
      0.0,
      670.3236106604302
    ],
    "TE_min": -46.799880785,
    "TE_min_K": 80.0,
    "alpha_integral_0_300K": -0.009727943228675002,
    "alpha_integral_0_600K": -0.011701536395489999,
    "alpha_integral_0_900K": -0.011514698201825001
  },
  {
    "material_folder": "Ag2B8O13-mp-1247866",
    "POSCAR": "Ag8 B32 O52\n1.0\n   8.4813650000000003    0.0000000000000000    0.0000000000000005\n   0.0000000000000017   10.5344698491409119   -2.0657833521272058\n   0.0000000000000000    0.0000000000000000   11.5893707199999998\nAg B O\n8 32 52\ndirect\n   0.1244640000000000    0.8149750000000000    0.6184860000000000 Ag\n   0.1331710000000000    0.4617660000000000    0.9250600000000000 Ag\n   0.3681080000000000    0.9611620000000000    0.9259470000000000 Ag\n   0.4137970000000000    0.3056500000000000    0.6147730000000000 Ag\n   0.6244640000000000    0.6850250000000000    0.3815140000000000 Ag\n   0.6331710000000000    0.0382340000000000    0.0749400000000000 Ag\n   0.8681080000000000    0.5388380000000000    0.0740530000000000 Ag\n   0.9137970000000000    0.1943500000000000    0.3852270000000000 Ag\n   0.0040960000000000    0.5404690000000000    0.7097580000000000 B\n   0.0415550000000000    0.6978290000000000    0.3277880000000000 B\n   0.0723460000000000    0.8918480000000000    0.2428820000000000 B\n   0.0775190000000000    0.7408470000000000    0.8720490000000000 B\n   0.0942360000000000    0.0656580000000000    0.1245420000000000 B\n   0.1143320000000000    0.1064420000000000    0.5999650000000000 B\n   0.1697030000000000    0.2194360000000000    0.0043120000000000 B\n   0.1791370000000000    0.5527620000000000    0.4399330000000000 B\n   0.3204460000000000    0.0525390000000000    0.4397210000000000 B\n   0.3305490000000000    0.7197180000000000    0.0047270000000000 B\n   0.3858760000000000    0.6047470000000000    0.5994850000000000 B\n   0.4062590000000000    0.5663870000000000    0.1253010000000000 B\n   0.4229630000000000    0.2412730000000000    0.8726260000000000 B\n   0.4291270000000000    0.3914650000000000    0.2419170000000000 B\n   0.4563610000000000    0.1977380000000000    0.3276250000000000 B\n   0.4964230000000000    0.0406780000000000    0.7102510000000000 B\n   0.5040960000000000    0.9595310000000000    0.2902420000000000 B\n   0.5415550000000000    0.8021710000000000    0.6722120000000000 B\n   0.5723460000000000    0.6081520000000000    0.7571180000000000 B\n   0.5775190000000000    0.7591530000000000    0.1279510000000000 B\n   0.5942360000000000    0.4343420000000000    0.8754580000000000 B\n   0.6143320000000000    0.3935580000000000    0.4000350000000000 B\n   0.6697030000000000    0.2805640000000000    0.9956880000000000 B\n   0.6791370000000000    0.9472380000000000    0.5600670000000000 B\n   0.8204460000000000    0.4474610000000000    0.5602790000000000 B\n   0.8305490000000000    0.7802820000000000    0.9952730000000000 B\n   0.8858760000000000    0.8952530000000000    0.4005150000000000 B\n   0.9062590000000000    0.9336130000000000    0.8746990000000000 B\n   0.9229630000000000    0.2587270000000000    0.1273740000000000 B\n   0.9291260000000000    0.1085350000000000    0.7580830000000000 B\n   0.9563610000000000    0.3022620000000000    0.6723749999999999 B\n   0.9964229999999999    0.4593220000000000    0.2897490000000000 B\n   0.0361470000000000    0.0420130000000000    0.6766360000000000 O\n   0.0220610000000000    0.4231330000000000    0.7397250000000000 O\n   0.0403840000000000    0.2910030000000000    0.0447680000000000 O\n   0.0344930000000000    0.8630730000000000    0.8347740000000000 O\n   0.0856070000000000    0.2303300000000000    0.5991860000000000 O\n   0.0966710000000000    0.4473040000000000    0.3820410000000000 O\n   0.0883710000000000    0.6425800000000000    0.7650560000000000 O\n   0.1112620000000000    0.7708390000000001    0.2460060000000000 O\n   0.1345770000000000    0.9535600000000000    0.1584760000000000 O\n   0.1598580000000000    0.6705750000000000    0.4145890000000000 O\n   0.1930800000000000    0.1021540000000000    0.0395290000000000 O\n   0.2177500000000000    0.0294920000000000    0.5262060000000000 O\n   0.2657710000000000    0.2611330000000000    0.9268430000000000 O\n   0.2347610000000000    0.7610350000000000    0.9268330000000000 O\n   0.2836720000000000    0.5285590000000000    0.5246820000000000 O\n   0.3069510000000000    0.6027749999999999    0.0404190000000000 O\n   0.3359050000000000    0.1699430000000000    0.4127710000000000 O\n   0.3654510000000000    0.4541280000000000    0.1587920000000000 O\n   0.3884070000000000    0.2709110000000000    0.2453410000000000 O\n   0.4128170000000000    0.1434910000000000    0.7649470000000000 O\n   0.4043040000000000    0.9476200000000000    0.3829870000000000 O\n   0.4091600000000000    0.7304600000000000    0.6027000000000000 O\n   0.4663320000000000    0.3634180000000000    0.8350750000000000 O\n   0.4598370000000000    0.7913249999999999    0.0452610000000000 O\n   0.4768890000000000    0.9234190000000000    0.7398100000000000 O\n   0.4686130000000000    0.5400000000000000    0.6737340000000001 O\n   0.5361470000000000    0.4579870000000000    0.3233640000000000 O\n   0.5220610000000000    0.0768670000000000    0.2602750000000000 O\n   0.5403840000000000    0.2089970000000000    0.9552320000000000 O\n   0.5344930000000000    0.6369270000000000    0.1652260000000000 O\n   0.5856070000000000    0.2696700000000000    0.4008140000000000 O\n   0.5966710000000000    0.0526960000000000    0.6179590000000000 O\n   0.5883710000000000    0.8574200000000000    0.2349440000000000 O\n   0.6112620000000000    0.7291609999999999    0.7539940000000001 O\n   0.6345769999999999    0.5464400000000000    0.8415240000000000 O\n   0.6598579999999999    0.8294250000000000    0.5854110000000000 O\n   0.6930800000000000    0.3978460000000000    0.9604710000000000 O\n   0.7177500000000000    0.4705080000000000    0.4737940000000000 O\n   0.7657710000000000    0.2388670000000000    0.0731570000000000 O\n   0.7347610000000000    0.7389650000000000    0.0731670000000000 O\n   0.7836720000000000    0.9714410000000000    0.4753180000000000 O\n   0.8069510000000000    0.8972250000000001    0.9595810000000000 O\n   0.8359050000000000    0.3300570000000000    0.5872290000000000 O\n   0.8654510000000000    0.0458720000000000    0.8412080000000000 O\n   0.8884069999999999    0.2290890000000000    0.7546590000000000 O\n   0.9128170000000000    0.3565090000000000    0.2350530000000000 O\n   0.9043040000000000    0.5523800000000000    0.6170130000000000 O\n   0.9091600000000000    0.7695400000000000    0.3973000000000000 O\n   0.9663320000000000    0.1365820000000000    0.1649250000000000 O\n   0.9598370000000001    0.7086750000000001    0.9547390000000000 O\n   0.9768890000000000    0.5765810000000000    0.2601900000000000 O\n   0.9686129999999999    0.9600000000000000    0.3262660000000000 O\n",
    "Material_Cost_USD_per_kg": 381.43,
    "Band_Gap_eV": 2.9324,
    "Pearson_Electronegativity_eV": 5.917447892919565,
    "CBM_eV": -4.451247892919565,
    "VBM_eV": -7.383647892919565,
    "K_GPa": 82.19071197509766,
    "G_GPa": 37.87346649169922,
    "E_GPa": 98.49202921474405,
    "E_tilde_GPa": 342.8181269648995,
    "E_coh_eV_per_atom": -5.860948371051291,
    "avg_cn": 2.739130434782609,
    "porosity": 0.7157936771508775,
    "AAV": 11.25512871734714,
    "TE_300K": -31.620497654999998,
    "T2": 990.0,